{
  "workspace": "/mnt/ssd-SATARAID5/harry/projects/cfd_agentic_benchmark/cfd_solver_benchmark_workspace_template/workspace/codex/dsv4_flash/07",
  "time_seconds": {
    "goal_time": 5885.0,
    "wall_time": 5901.7,
    "started_at": "2026-08-04T10:00:18.876000+00:00",
    "ended_at": "2026-08-04T11:38:40.576000+00:00",
    "by_root_thread": {
      "019fcc37-26b8-7960-8a53-79430001b739": {
        "status": "complete",
        "time_used_seconds": 5885,
        "tokens_used": 1228084
      }
    },
    "by_root_tree": {
      "019fcc37-26b8-7960-8a53-79430001b739": {
        "status": "complete",
        "goal_time_seconds": 5885,
        "goal_tokens": 1228084,
        "threads": 1,
        "tokens_used": 62231413,
        "model": "BLSC/DeepSeek-V4-Flash"
      }
    }
  },
  "tokens": {
    "total": 62231413,
    "by_model": {
      "BLSC/DeepSeek-V4-Flash": {
        "input": 62032047,
        "cached_input": 60999552,
        "non_cached_input": 1032495,
        "output": 199366,
        "reasoning_output": 65563,
        "total": 62231413,
        "fallback_tokens": 0
      }
    },
    "by_thread": {
      "019fcc37-26b8-7960-8a53-79430001b739": {
        "model": "BLSC/DeepSeek-V4-Flash",
        "is_subagent": false,
        "source": "rollout_cumulative",
        "tokens": {
          "BLSC/DeepSeek-V4-Flash": {
            "input": 62032047,
            "cached": 60999552,
            "non_cached": 1032495,
            "output": 199366,
            "reasoning_output": 65563,
            "total": 62231413
          }
        },
        "total": 62231413
      }
    },
    "main_vs_subagent": {
      "main": 62231413,
      "subagent": 0
    },
    "fallback_tokens": 0,
    "discrepancy_notes": [],
    "accounting_note": "Cached/input/output splits come from each selected thread's terminal rollout counter and are scaled only when needed to match state_5.sqlite threads.tokens_used."
  },
  "cost_estimate_usd": {
    "total": 2.0808,
    "by_model": {
      "BLSC/DeepSeek-V4-Flash": {
        "usd": 2.0808,
        "tokens": 62231413,
        "pricing": "metadata"
      }
    },
    "unpriced_tokens": 0,
    "estimate": true,
    "metadata": "/mnt/ssd-SATARAID5/harry/projects/cfd_agentic_benchmark/cfd_solver_benchmark_workspace_template/evaluation/config/cost_metadata.json"
  },
  "provenance": {
    "state_db": "/mnt/ssd-SATARAID5/harry/projects/cfd_agentic_benchmark/cfd_solver_benchmark_workspace_template/workspace/codex/dsv4_flash/07/.sessions/codex/state_5.sqlite",
    "goals_db": "/mnt/ssd-SATARAID5/harry/projects/cfd_agentic_benchmark/cfd_solver_benchmark_workspace_template/workspace/codex/dsv4_flash/07/.sessions/codex/goals_1.sqlite",
    "logs_db": "/mnt/ssd-SATARAID5/harry/projects/cfd_agentic_benchmark/cfd_solver_benchmark_workspace_template/workspace/codex/dsv4_flash/07/.sessions/codex/logs_2.sqlite",
    "sessions_root": "/mnt/ssd-SATARAID5/harry/projects/cfd_agentic_benchmark/cfd_solver_benchmark_workspace_template/workspace/codex/dsv4_flash/07/.sessions/codex/sessions",
    "fetched_at": "2026-08-15T03:19:52.848498+00:00",
    "num_threads": 1,
    "num_roots": 1
  }
}
