{
  "workspace": "/mnt/ssd-SATARAID5/harry/projects/cfd_agentic_benchmark/cfd_solver_benchmark_workspace_template/workspace/codex/glm52-m3/01",
  "time_seconds": {
    "goal_time": 4907.0,
    "wall_time": 5045.6,
    "started_at": "2026-08-01T20:12:51.919000+00:00",
    "ended_at": "2026-08-01T21:36:57.469000+00:00",
    "by_root_thread": {
      "019fbef6-8a0e-71f0-8642-db5302a41979": {
        "status": "complete",
        "time_used_seconds": 4885,
        "tokens_used": 714758
      },
      "019fbef4-a59e-7ec0-9455-8c961d3b1cbf": {
        "status": "paused",
        "time_used_seconds": 22,
        "tokens_used": 23143
      }
    },
    "by_root_tree": {
      "019fbef6-8a0e-71f0-8642-db5302a41979": {
        "status": "complete",
        "goal_time_seconds": 4885,
        "goal_tokens": 714758,
        "threads": 1,
        "tokens_used": 40557801,
        "model": "BLSC/GLM-5.2"
      },
      "019fbef4-a59e-7ec0-9455-8c961d3b1cbf": {
        "status": "paused",
        "goal_time_seconds": 22,
        "goal_tokens": 23143,
        "threads": 1,
        "tokens_used": 78119,
        "model": "BLSC/GLM-5.2"
      }
    }
  },
  "tokens": {
    "total": 40635920,
    "by_model": {
      "BLSC/GLM-5.2": {
        "input": 0,
        "cached_input": 0,
        "non_cached_input": 0,
        "output": 0,
        "reasoning_output": 0,
        "total": 40635920,
        "fallback_tokens": 40635920
      }
    },
    "by_thread": {
      "019fbef4-a59e-7ec0-9455-8c961d3b1cbf": {
        "model": "BLSC/GLM-5.2",
        "is_subagent": false,
        "source": "threads_fallback",
        "tokens": {
          "BLSC/GLM-5.2": {
            "input": 0,
            "cached": 0,
            "non_cached": 0,
            "output": 0,
            "reasoning_output": 0,
            "total": 78119
          }
        },
        "total": 78119,
        "fallback_tokens": 78119
      },
      "019fbef6-8a0e-71f0-8642-db5302a41979": {
        "model": "BLSC/GLM-5.2",
        "is_subagent": false,
        "source": "threads_fallback",
        "tokens": {
          "BLSC/GLM-5.2": {
            "input": 0,
            "cached": 0,
            "non_cached": 0,
            "output": 0,
            "reasoning_output": 0,
            "total": 40557801
          }
        },
        "total": 40557801,
        "fallback_tokens": 40557801
      }
    },
    "main_vs_subagent": {
      "main": 40635920,
      "subagent": 0
    },
    "fallback_tokens": 40635920,
    "discrepancy_notes": []
  },
  "cost_estimate_usd": {
    "total": 28.4451,
    "by_model": {
      "BLSC/GLM-5.2": {
        "usd": 28.4451,
        "tokens": 40635920,
        "pricing": "metadata"
      }
    },
    "unpriced_tokens": 0,
    "estimate": true,
    "metadata": "/home/harry/ssd1/projects/cfd_agentic_benchmark/cfd_solver_benchmark_workspace_template/evaluation/config/cost_metadata.json"
  },
  "provenance": {
    "state_db": "/home/harry/ssd1/projects/cfd_agentic_benchmark/cfd_solver_benchmark_workspace_template/workspace/codex/glm52-m3/01/.sessions/codex/state_5.sqlite",
    "goals_db": "/home/harry/ssd1/projects/cfd_agentic_benchmark/cfd_solver_benchmark_workspace_template/workspace/codex/glm52-m3/01/.sessions/codex/goals_1.sqlite",
    "logs_db": "/home/harry/ssd1/projects/cfd_agentic_benchmark/cfd_solver_benchmark_workspace_template/workspace/codex/glm52-m3/01/.sessions/codex/logs_2.sqlite",
    "sessions_root": "/home/harry/ssd1/projects/cfd_agentic_benchmark/cfd_solver_benchmark_workspace_template/workspace/codex/glm52-m3/01/.sessions/codex/sessions",
    "fetched_at": "2026-08-13T11:59:39.956012+00:00",
    "num_threads": 2,
    "num_roots": 2
  }
}
