{
  "workspace": "/mnt/ssd-SATARAID5/harry/projects/cfd_agentic_benchmark/cfd_solver_benchmark_workspace_template/workspace/codex/glm52-m3/06",
  "time_seconds": {
    "goal_time": 66990.0,
    "wall_time": 111259.0,
    "started_at": "2026-08-14T08:26:46.981000+00:00",
    "ended_at": "2026-08-15T15:21:05.936000+00:00",
    "by_root_thread": {
      "019fff60-e8b8-7990-8df2-f0784bde7d60": {
        "status": "blocked",
        "time_used_seconds": 66990,
        "tokens_used": 3921672
      }
    },
    "by_root_tree": {
      "019fff60-e8b8-7990-8df2-f0784bde7d60": {
        "status": "blocked",
        "goal_time_seconds": 66990,
        "goal_tokens": 3921672,
        "threads": 8,
        "tokens_used": 325077202,
        "state_tokens_inherited_inclusive": 325794414,
        "model": "BLSC/GLM-5.2"
      }
    }
  },
  "tokens": {
    "total": 325077202,
    "by_model": {
      "BLSC/GLM-5.2": {
        "input": 320133979,
        "cached_input": 317093184,
        "non_cached_input": 3040795,
        "output": 1461461,
        "reasoning_output": 996034,
        "total": 321595440,
        "fallback_tokens": 0
      },
      "BLSC/MiniMax-M3": {
        "input": 3456644,
        "cached_input": 3230231,
        "non_cached_input": 226413,
        "output": 25118,
        "reasoning_output": 0,
        "total": 3481762,
        "fallback_tokens": 0
      }
    },
    "by_thread": {
      "019fff60-e8b8-7990-8df2-f0784bde7d60": {
        "model": "BLSC/GLM-5.2",
        "is_subagent": false,
        "source": "rollout_cumulative",
        "tokens": {
          "BLSC/GLM-5.2": {
            "input": 311248103,
            "cached": 308633216,
            "non_cached": 2614887,
            "output": 1308501,
            "reasoning_output": 930747,
            "total": 312556604
          }
        },
        "total": 312556604,
        "inherited_baseline_tokens": 0
      },
      "01a00462-27e5-7e93-ad09-5b13d5483858": {
        "model": "BLSC/MiniMax-M3",
        "is_subagent": true,
        "source": "rollout_fork_delta",
        "tokens": {
          "BLSC/MiniMax-M3": {
            "input": 265928,
            "cached": 215703,
            "non_cached": 50225,
            "output": 4744,
            "reasoning_output": 0,
            "total": 270672
          }
        },
        "total": 270672,
        "inherited_baseline_tokens": 0
      },
      "01a0049c-5f0b-7593-b6c1-6e726f22b95a": {
        "model": "BLSC/GLM-5.2",
        "is_subagent": true,
        "source": "rollout_fork_delta",
        "tokens": {
          "BLSC/GLM-5.2": {
            "input": 2840076,
            "cached": 2742784,
            "non_cached": 97292,
            "output": 40051,
            "reasoning_output": 28848,
            "total": 2880127
          }
        },
        "total": 2880127,
        "inherited_baseline_tokens": 0
      },
      "01a00580-f5f9-76b0-a9a7-336611d70a57": {
        "model": "BLSC/GLM-5.2",
        "is_subagent": true,
        "source": "rollout_fork_delta",
        "tokens": {
          "BLSC/GLM-5.2": {
            "input": 482248,
            "cached": 419072,
            "non_cached": 63176,
            "output": 11813,
            "reasoning_output": 2580,
            "total": 494061
          }
        },
        "total": 494061,
        "inherited_baseline_tokens": 0
      },
      "01a00581-c9fc-7541-93ba-00e8f9250f98": {
        "model": "BLSC/GLM-5.2",
        "is_subagent": true,
        "source": "rollout_fork_delta",
        "tokens": {
          "BLSC/GLM-5.2": {
            "input": 3611144,
            "cached": 3479872,
            "non_cached": 131272,
            "output": 52224,
            "reasoning_output": 20561,
            "total": 3663368
          }
        },
        "total": 3663368,
        "inherited_baseline_tokens": 0
      },
      "01a00581-ca4a-7042-8171-2482b95edd8f": {
        "model": "BLSC/GLM-5.2",
        "is_subagent": true,
        "source": "rollout_fork_delta",
        "tokens": {
          "BLSC/GLM-5.2": {
            "input": 1952408,
            "cached": 1818240,
            "non_cached": 134168,
            "output": 48872,
            "reasoning_output": 13298,
            "total": 2001280
          }
        },
        "total": 2001280,
        "inherited_baseline_tokens": 0
      },
      "01a005fb-86b2-7ab1-b0bd-f3bc3c7f2501": {
        "model": "BLSC/MiniMax-M3",
        "is_subagent": true,
        "source": "rollout_fork_delta",
        "tokens": {
          "BLSC/MiniMax-M3": {
            "input": 1630745,
            "cached": 1590528,
            "non_cached": 40217,
            "output": 6665,
            "reasoning_output": 0,
            "total": 1637410
          }
        },
        "total": 1637410,
        "inherited_baseline_tokens": 0
      },
      "01a005fe-2e04-78b1-96cf-43b7d4d7c271": {
        "model": "BLSC/MiniMax-M3",
        "is_subagent": true,
        "source": "rollout_fork_delta",
        "tokens": {
          "BLSC/MiniMax-M3": {
            "input": 1559971,
            "cached": 1424000,
            "non_cached": 135971,
            "output": 13709,
            "reasoning_output": 0,
            "total": 1573680
          }
        },
        "total": 1573680,
        "inherited_baseline_tokens": 717212
      }
    },
    "main_vs_subagent": {
      "main": 312556604,
      "subagent": 12520598
    },
    "fallback_tokens": 0,
    "discrepancy_notes": [
      "thread 01a005fe-2e04-78b1-96cf-43b7d4d7c271: ignored inherited-inclusive state token counter 2290892; rollout-owned usage is 1573680"
    ],
    "accounting_note": "Cached/input/output splits come from thread-owned rollout counter deltas. Fork replay is excluded at the first child-owned task boundary, and fork state counters are diagnostic only. A standalone root may retain the legacy state-counter scaling fallback when its rollout ends before the persisted root total."
  },
  "cost_estimate_usd": {
    "total": 101.8531,
    "by_model": {
      "BLSC/GLM-5.2": {
        "usd": 101.2694,
        "tokens": 321595440,
        "pricing": "metadata"
      },
      "BLSC/MiniMax-M3": {
        "usd": 0.5838,
        "tokens": 3481762,
        "pricing": "metadata"
      }
    },
    "unpriced_tokens": 0,
    "estimate": true,
    "metadata": "/mnt/ssd-SATARAID5/harry/projects/cfd_agentic_benchmark/cfd_solver_benchmark_workspace_template/evaluation/config/cost_metadata.json"
  },
  "provenance": {
    "state_db": "/mnt/ssd-SATARAID5/harry/projects/cfd_agentic_benchmark/cfd_solver_benchmark_workspace_template/workspace/codex/glm52-m3/06/.sessions/codex/state_5.sqlite",
    "goals_db": "/mnt/ssd-SATARAID5/harry/projects/cfd_agentic_benchmark/cfd_solver_benchmark_workspace_template/workspace/codex/glm52-m3/06/.sessions/codex/goals_1.sqlite",
    "logs_db": "/mnt/ssd-SATARAID5/harry/projects/cfd_agentic_benchmark/cfd_solver_benchmark_workspace_template/workspace/codex/glm52-m3/06/.sessions/codex/logs_2.sqlite",
    "sessions_root": "/mnt/ssd-SATARAID5/harry/projects/cfd_agentic_benchmark/cfd_solver_benchmark_workspace_template/workspace/codex/glm52-m3/06/.sessions/codex/sessions",
    "fetched_at": "2026-08-16T12:06:42.861301+00:00",
    "num_threads": 8,
    "num_roots": 1
  }
}
