{
  "note": "OpenCode selected-session-tree token facts; current manager price estimate is separate from provider-reported cost",
  "workspace": "/mnt/ssd-SATARAID5/harry/projects/cfd_agentic_benchmark/cfd_solver_benchmark_workspace_template/workspace/omo-slim/dsv4/08",
  "time_seconds": {
    "goal_time": 0,
    "wall_time": 0,
    "activity_time_seconds": 21224.2,
    "idle_time_seconds": 250308.8,
    "idle_gap_threshold_seconds": 600,
    "started_at": "2026-08-05T08:50:23.158000+00:00",
    "ended_at": "2026-08-06T10:07:55.309000+00:00"
  },
  "tokens": {
    "total": 147730902,
    "by_model": {
      "deepseek/deepseek-v4-flash": {
        "input": 139592517,
        "cached_input": 138305664,
        "non_cached_input": 1286853,
        "output": 416539,
        "reasoning_output": 649888,
        "total": 140658944,
        "reasoning_is_output_subset": false
      },
      "deepseek/deepseek-v4-pro": {
        "input": 7013408,
        "cached_input": 6713344,
        "non_cached_input": 300064,
        "output": 47307,
        "reasoning_output": 11243,
        "total": 7071958,
        "reasoning_is_output_subset": false
      }
    },
    "by_thread": {
      "ses_02978aaeeffeSppUx1TYV5Ue0U": {
        "model": "deepseek-v4-flash",
        "provider": "deepseek",
        "variant": "max",
        "is_subagent": true,
        "source": "opencode_session",
        "tokens": {
          "deepseek/deepseek-v4-flash": {
            "input": 507850,
            "cached_input": 484352,
            "non_cached_input": 23498,
            "output": 5927,
            "reasoning_output": 15728,
            "reasoning_is_output_subset": false,
            "total": 529505
          }
        },
        "total": 529505
      },
      "ses_02987d0d1ffevMidHzJag1zdjj": {
        "model": "deepseek-v4-flash",
        "provider": "deepseek",
        "variant": "max",
        "is_subagent": true,
        "source": "opencode_session",
        "tokens": {
          "deepseek/deepseek-v4-flash": {
            "input": 5703916,
            "cached_input": 5634432,
            "non_cached_input": 69484,
            "output": 32811,
            "reasoning_output": 23968,
            "reasoning_is_output_subset": false,
            "total": 5760695
          }
        },
        "total": 5760695
      },
      "ses_02b7816deffehQMCVDXUlUNZ17": {
        "model": "deepseek-v4-flash",
        "provider": "deepseek",
        "variant": "max",
        "is_subagent": true,
        "source": "opencode_session",
        "tokens": {
          "deepseek/deepseek-v4-flash": {
            "input": 10602360,
            "cached_input": 10524032,
            "non_cached_input": 78328,
            "output": 31908,
            "reasoning_output": 40558,
            "reasoning_is_output_subset": false,
            "total": 10674826
          }
        },
        "total": 10674826
      },
      "ses_02eb69009ffe67o4s6hmEJvMF3": {
        "model": "deepseek-v4-flash",
        "provider": "deepseek",
        "variant": "max",
        "is_subagent": true,
        "source": "opencode_session",
        "tokens": {
          "deepseek/deepseek-v4-flash": {
            "input": 100435204,
            "cached_input": 99757824,
            "non_cached_input": 677380,
            "output": 223425,
            "reasoning_output": 428051,
            "reasoning_is_output_subset": false,
            "total": 101086680
          }
        },
        "total": 101086680
      },
      "ses_02ec9283effe5xmYlfNPigDhxS": {
        "model": "deepseek-v4-flash",
        "provider": "deepseek",
        "variant": "max",
        "is_subagent": true,
        "source": "opencode_session",
        "tokens": {
          "deepseek/deepseek-v4-flash": {
            "input": 4849706,
            "cached_input": 4782080,
            "non_cached_input": 67626,
            "output": 27468,
            "reasoning_output": 28226,
            "reasoning_is_output_subset": false,
            "total": 4905400
          }
        },
        "total": 4905400
      },
      "ses_02ed9ad1affegTR8k7NEd0CRKm": {
        "model": "deepseek-v4-flash",
        "provider": "deepseek",
        "variant": "max",
        "is_subagent": true,
        "source": "opencode_session",
        "tokens": {
          "deepseek/deepseek-v4-flash": {
            "input": 4017562,
            "cached_input": 3847296,
            "non_cached_input": 170266,
            "output": 13780,
            "reasoning_output": 76336,
            "reasoning_is_output_subset": false,
            "total": 4107678
          }
        },
        "total": 4107678
      },
      "ses_02edf49eaffeEWfeJRVEPT12Kh": {
        "model": "deepseek-v4-flash",
        "provider": "deepseek",
        "variant": "max",
        "is_subagent": true,
        "source": "opencode_session",
        "tokens": {
          "deepseek/deepseek-v4-flash": {
            "input": 1017049,
            "cached_input": 949760,
            "non_cached_input": 67289,
            "output": 6640,
            "reasoning_output": 4082,
            "reasoning_is_output_subset": false,
            "total": 1027771
          }
        },
        "total": 1027771
      },
      "ses_02edf7ca2ffeBsOaKYY1tCZvic": {
        "model": "deepseek-v4-flash",
        "provider": "deepseek",
        "variant": "max",
        "is_subagent": true,
        "source": "opencode_session",
        "tokens": {
          "deepseek/deepseek-v4-flash": {
            "input": 12458870,
            "cached_input": 12325888,
            "non_cached_input": 132982,
            "output": 74580,
            "reasoning_output": 32939,
            "reasoning_is_output_subset": false,
            "total": 12566389
          }
        },
        "total": 12566389
      },
      "ses_02ee222c9ffedH2tM4IIpR6lq1": {
        "model": "deepseek-v4-pro",
        "provider": "deepseek",
        "variant": "max",
        "is_subagent": false,
        "source": "opencode_session",
        "tokens": {
          "deepseek/deepseek-v4-pro": {
            "input": 7013408,
            "cached_input": 6713344,
            "non_cached_input": 300064,
            "output": 47307,
            "reasoning_output": 11243,
            "reasoning_is_output_subset": false,
            "total": 7071958
          }
        },
        "total": 7071958
      }
    },
    "main_vs_subagent": {
      "main": 7071958,
      "subagent": 140658944
    }
  },
  "cost_estimate_usd": {
    "total": 5.3231,
    "by_model": {
      "deepseek/deepseek-v4-flash": {
        "usd": 4.6808,
        "tokens": 140658944,
        "pricing": "metadata"
      },
      "deepseek/deepseek-v4-pro": {
        "usd": 0.6423,
        "tokens": 7071958,
        "pricing": "metadata"
      }
    },
    "unpriced_tokens": 0,
    "estimate": true,
    "metadata": "/mnt/ssd-SATARAID5/harry/projects/cfd_agentic_benchmark/cfd_solver_benchmark_workspace_template/evaluation/config/cost_metadata.json",
    "provider_reported_total": 1.071817
  },
  "provenance": {
    "source": "workspace-local OpenCode metadata selected session tree",
    "selected_roots": [
      "ses_02ee222c9ffedH2tM4IIpR6lq1"
    ],
    "provider_reported_total": 1.071817
  }
}
