{
  "workspace": "/mnt/ssd-SATARAID5/harry/projects/cfd_agentic_benchmark/cfd_solver_benchmark_workspace_template/workspace/codex/glm52-m3/05",
  "time_seconds": {
    "goal_time": 23287.0,
    "wall_time": 23296.7,
    "started_at": "2026-08-09T21:15:51.533000+00:00",
    "ended_at": "2026-08-10T03:44:08.214000+00:00",
    "by_root_thread": {
      "019fe861-1832-71b0-b1ae-2f9d13afd309": {
        "status": "complete",
        "time_used_seconds": 23287,
        "tokens_used": 3768471
      }
    },
    "by_root_tree": {
      "019fe861-1832-71b0-b1ae-2f9d13afd309": {
        "status": "complete",
        "goal_time_seconds": 23287,
        "goal_tokens": 3768471,
        "threads": 1,
        "tokens_used": 241544063,
        "model": "BLSC/GLM-5.2"
      }
    }
  },
  "tokens": {
    "total": 241544063,
    "by_model": {
      "BLSC/GLM-5.2": {
        "input": 241014119,
        "cached_input": 237774784,
        "non_cached_input": 3239335,
        "output": 529944,
        "reasoning_output": 284053,
        "total": 241544063,
        "fallback_tokens": 0
      }
    },
    "by_thread": {
      "019fe861-1832-71b0-b1ae-2f9d13afd309": {
        "model": "BLSC/GLM-5.2",
        "is_subagent": false,
        "source": "rollout_cumulative",
        "tokens": {
          "BLSC/GLM-5.2": {
            "input": 241014119,
            "cached": 237774784,
            "non_cached": 3239335,
            "output": 529944,
            "reasoning_output": 284053,
            "total": 241544063
          }
        },
        "total": 241544063
      }
    },
    "main_vs_subagent": {
      "main": 241544063,
      "subagent": 0
    },
    "fallback_tokens": 0,
    "discrepancy_notes": [],
    "accounting_note": "Cached/input/output splits come from each selected thread's terminal rollout counter and are scaled only when needed to match state_5.sqlite threads.tokens_used."
  },
  "cost_estimate_usd": {
    "total": 25.9211,
    "by_model": {
      "BLSC/GLM-5.2": {
        "usd": 25.9211,
        "tokens": 241544063,
        "pricing": "metadata"
      }
    },
    "unpriced_tokens": 0,
    "estimate": true,
    "metadata": "/mnt/ssd-SATARAID5/harry/projects/cfd_agentic_benchmark/cfd_solver_benchmark_workspace_template/evaluation/config/cost_metadata.json"
  },
  "provenance": {
    "state_db": "/mnt/ssd-SATARAID5/harry/projects/cfd_agentic_benchmark/cfd_solver_benchmark_workspace_template/workspace/codex/glm52-m3/05/.sessions/codex/state_5.sqlite",
    "goals_db": "/mnt/ssd-SATARAID5/harry/projects/cfd_agentic_benchmark/cfd_solver_benchmark_workspace_template/workspace/codex/glm52-m3/05/.sessions/codex/goals_1.sqlite",
    "logs_db": "/mnt/ssd-SATARAID5/harry/projects/cfd_agentic_benchmark/cfd_solver_benchmark_workspace_template/workspace/codex/glm52-m3/05/.sessions/codex/logs_2.sqlite",
    "sessions_root": "/mnt/ssd-SATARAID5/harry/projects/cfd_agentic_benchmark/cfd_solver_benchmark_workspace_template/workspace/codex/glm52-m3/05/.sessions/codex/sessions",
    "fetched_at": "2026-08-15T02:52:35.159500+00:00",
    "num_threads": 1,
    "num_roots": 1
  }
}
