{
  "workspace": "/mnt/ssd-SATARAID5/harry/projects/cfd_agentic_benchmark/cfd_solver_benchmark_workspace_template/workspace/codex/gpt56/07",
  "time_seconds": {
    "goal_time": 690.0,
    "wall_time": 164470.0,
    "started_at": "2026-08-07T11:15:02.806000+00:00",
    "ended_at": "2026-08-09T08:56:12.800000+00:00",
    "by_root_thread": {
      "019fdbed-a7d0-7072-a8ca-4ce5a84e49c0": {
        "status": "complete",
        "time_used_seconds": 690,
        "tokens_used": 239845
      }
    },
    "by_root_tree": {
      "019fdbed-a7d0-7072-a8ca-4ce5a84e49c0": {
        "status": "complete",
        "goal_time_seconds": 690,
        "goal_tokens": 239845,
        "threads": 1,
        "tokens_used": 179288436,
        "model": "gpt-5.5"
      }
    }
  },
  "tokens": {
    "total": 179288436,
    "by_model": {
      "gpt-5.5": {
        "input": 178927179,
        "cached_input": 175953920,
        "non_cached_input": 2973259,
        "output": 361257,
        "reasoning_output": 130813,
        "total": 179288436,
        "fallback_tokens": 0
      }
    },
    "by_thread": {
      "019fdbed-a7d0-7072-a8ca-4ce5a84e49c0": {
        "model": "gpt-5.5",
        "is_subagent": false,
        "source": "rollout_cumulative",
        "tokens": {
          "gpt-5.5": {
            "input": 178927179,
            "cached": 175953920,
            "non_cached": 2973259,
            "output": 361257,
            "reasoning_output": 130813,
            "total": 179288436
          }
        },
        "total": 179288436
      }
    },
    "main_vs_subagent": {
      "main": 179288436,
      "subagent": 0
    },
    "fallback_tokens": 0,
    "discrepancy_notes": [],
    "accounting_note": "Cached/input/output splits come from each selected thread's terminal rollout counter and are scaled only when needed to match state_5.sqlite threads.tokens_used."
  },
  "cost_estimate_usd": {
    "total": 60.1153,
    "by_model": {
      "gpt-5.5": {
        "usd": 60.1153,
        "tokens": 179288436,
        "pricing": "metadata"
      }
    },
    "unpriced_tokens": 0,
    "estimate": true,
    "metadata": "/mnt/ssd-SATARAID5/harry/projects/cfd_agentic_benchmark/cfd_solver_benchmark_workspace_template/evaluation/config/cost_metadata.json"
  },
  "provenance": {
    "state_db": "/mnt/ssd-SATARAID5/harry/projects/cfd_agentic_benchmark/cfd_solver_benchmark_workspace_template/workspace/codex/gpt56/07/.sessions/codex/state_5.sqlite",
    "goals_db": "/mnt/ssd-SATARAID5/harry/projects/cfd_agentic_benchmark/cfd_solver_benchmark_workspace_template/workspace/codex/gpt56/07/.sessions/codex/goals_1.sqlite",
    "logs_db": "/mnt/ssd-SATARAID5/harry/projects/cfd_agentic_benchmark/cfd_solver_benchmark_workspace_template/workspace/codex/gpt56/07/.sessions/codex/logs_2.sqlite",
    "sessions_root": "/mnt/ssd-SATARAID5/harry/projects/cfd_agentic_benchmark/cfd_solver_benchmark_workspace_template/workspace/codex/gpt56/07/.sessions/codex/sessions",
    "fetched_at": "2026-08-15T06:44:45.425920+00:00",
    "num_threads": 1,
    "num_roots": 1
  }
}
